ieee,,,,,,,,,,,,,,,,,,,,,,,,,,,
Decision Support Based on Human-Machine Collaboration Patterns: Conceptual Model and Scenario,A. Smirnov; T. Levashova,"St. Petersburg Federal Research Center of the Russian Academy of Sciences, St. Petersburg, Russia; St. Petersburg Federal Research Center of the Russian Academy of Sciences, St. Petersburg, Russia",2024 35th Conference of Open Innovations Association (FRUCT),9 May 2024,2024,,,715,724,The paper proposes a conceptual model of human-machine collaborative decision support in which humans and software agents use collaboration patterns to achieve goals of decision-making process steps. An analysis of collaboration patterns identified in multiple domains is provided and a pattern classification is offered. A sample scenario for collaborative decision support is proposed. The scenario illustrates a possible functionality of a collaborative decision support system implemented according to the conceptual model developed.,2305-7254,978-952-65246-1-0,10.23919/FRUCT61870.2024.10516361,,https://ieeexplore.ieee.org/stamp/stamp.jsp?arnumber=10516361,,Decision support systems;Measurement;Analytical models;Technological innovation;Human-machine systems;Collaboration;Pattern classification,,,,25,,9 May 2024,,,IEEE,IEEE Conferences
Reliable Time Series Counterfactual Explanations Guided by ShapeDBA,P. Li; P. Hosseinzadeh; O. Bahri; S. F. Boubrahimi; S. M. Hamdi,"Department of Computer Science, Utah State University, Logan, UT; Department of Computer Science, Utah State University, Logan, UT; Department of Computer Science, Utah State University, Logan, UT; Department of Computer Science, Utah State University, Logan, UT; Department of Computer Science, Utah State University, Logan, UT",2024 IEEE International Conference on Big Data (BigData),16 Jan 2025,2024,,,1574,1579,"Artificial intelligence (AI) and algorithmic decision-making are profoundly shaping various aspects of society, with applications in healthcare, business, education, etc. As these systems become more integral to high-stakes decisions, concerns about their transparency and interpretability are growing. To address these concerns, explainable AI (XAI) methods have been developed, with counterfactual explanations emerging as a powerful tool. Counterfactuals help users understand AI decisions by demonstrating how small changes in input could alter the outcome, providing a clear and intuitive way to interpret AI behavior. Despite their potential, generating valid, interpretable, and efficient counterfactual explanations is particularly challenging in time series domains, where data points are interdependent. In this paper, we introduce a novel approach to counterfactual explanations guided by ShapeDTW Barycenter Averaging (ShapeDBA). By integrating ShapeDBA into the counterfactual generation process, we ensure that the produced explanations are not only valid and interpretable but also efficient to generate. Our approach provides counterfactuals that align closely with human intuition while maintaining the computational efficiency required for practical deployment. This work represents a significant step forward in the development of interpretable AI systems, particularly in the complex domain of time series analysis.",2573-2978,979-8-3503-6248-0,10.1109/BigData62323.2024.10825447,,https://ieeexplore.ieee.org/stamp/stamp.jsp?arnumber=10825447,Explainable Artificial Intelligence (XAI);counterfactual explanations;time series classification;DTW barycenter averaging,Explainable AI;Computational modeling;Time series analysis;Education;Decision making;Medical services;Big Data;Computational efficiency;Reliability;Business,,,,25,IEEE,16 Jan 2025,,,IEEE,IEEE Conferences
User centric explanations: a breakthrough for explainable models,A. Hassan; M. A. A. Abdulhak; R. Bin Sulaiman; H. Kahtan,"Institute of IR 4.0 (IIR4.0), The National University of Malaysia, Bangi, Malaysia; Consultant & Researcher, Madinah, Saudi Arabia; Institute of IR 4.0 (IIR4.0), The National University of Malaysia, Bangi, Malaysia; Department of Software Engineering, Faculty of Computer Science and Information Technology, Universiti Malaya, Kuala Lumpur, Malaysia",2021 International Conference on Information Technology (ICIT),26 Jul 2021,2021,,,702,707,"Thanks to recent developments in explainable Deep Learning models, researchers have shown that these models can be incredibly successful and provide encouraging results. However, a lack of model interpretability can hinder the efficient implementation of Deep Learning models in real-world applications. This has encouraged researchers to develop and design a large number of algorithms to support transparency. Although studies have raised awareness of the importance of explainable artificial intelligence, the question of how to solve the needs of real users to understand artificial intelligence remains unanswered. In this paper, we provide an overview of the current state of the research field at Human-Centered Machine Learning and new methods for user-centric explanations for deep learning models. Furthermore, we outline future directions for interpretable machine learning and discuss the challenges facing this research field, as well as the importance and motivation behind developing user-centric explanations for Deep Learning models.",,978-1-6654-2870-5,10.1109/ICIT52682.2021.9491641,,https://ieeexplore.ieee.org/stamp/stamp.jsp?arnumber=9491641,explainable artificial intelligence;human-AI interaction;machine learning,Deep learning;Industries;Machine learning algorithms;Social sciences;Collaboration;Medical services;Learning (artificial intelligence),,1,,51,IEEE,26 Jul 2021,,,IEEE,IEEE Conferences
Exploring Trust and Explainability of Unmanned Systems,J. R. Field,"Naval Architecture & Eng. Dept., Carderock Division, Naval Sea Systems Command, West Bethesda, MD, USA",OCEANS 2023 - Limerick,12 Sep 2023,2023,,,1,6,"Explainability (often referred to as interpretability) refers to the concept of providing context to an AI/ML model and its output, thereby assisting a human user in understanding the system’s decision-making process. The concept of explainability is especially helpful when we consider the high cognitive load and intense data management strategies that are required for current human-in-the-loop operations in use today. The work presented here aims to provide an explainability framework for autonomous systems, to provide system transparency, and enhance operator awareness. This work served to develop a novel method of sorting and evaluating data streams taken from an operational system, to filter and transmit data packages based on mission conditions. Post mission analysis yielded apparent trends in messaging hierarchy, indicating that certain health and status data streams were consistently prioritized, regardless of the pre-defined metrics. Additional data analysis was performed to evaluate sensor outputs with respect to health and status messaging. This process included conducting data correlation and data characterization, to evaluate relationships between data streams, identify data associated with nominal behavior, and perform anomaly detection. Key functional categories were developed, in which the system’s behavior is mapped to a corresponding component (and its respective data stream). Monitoring subsystem performance assists with cross-referencing sensor outputs, to confirm data projections and/or aid in identifying faulty readings. Furthermore, the application of anomaly detection algorithms is coupled with data correlation and/or pattern recognition to extract the most important and salient information.",,979-8-3503-3226-1,10.1109/OCEANSLimerick52467.2023.10244349,,https://ieeexplore.ieee.org/stamp/stamp.jsp?arnumber=10244349,Autonomy;Explainability;UUV,Measurement;Correlation;Oceans;Market research;Human in the loop;Behavioral sciences;Anomaly detection,,,,10,USGov,12 Sep 2023,,,IEEE,IEEE Conferences
Securing SCADA Systems: A Protocol-Based Intrusion Detection Approach with Shapley Analysis,S. Ustebay; B. B. Akgün; P. Gaj,"Computer Engineering, Istanbul Medeniyet University, Istanbul, Türkiye; Computer Engineering, Istanbul Medeniyet University, Istanbul, Türkiye; Istributed systems and IT devices, Silesian University of Technology, Gliwice, Poland",2024 Innovations in Intelligent Systems and Applications Conference (ASYU),28 Nov 2024,2024,,,1,7,"This paper presents an approach to enhancing the security of Supervisory Control and Data Acquisition (SCADA) systems through the development of Explainable Intrusion Detection Systems (X-IDS). SCADA systems play a crucial role in managing industrial processes and critical infrastructure, yet they are increasingly targeted by cyberattacks, posing significant risks to operational integrity. Leveraging Machine Learning (ML) techniques, particularly focused on network protocols involved in communication with SCADA HMI, this study proposes a protocol-based layered IDS framework to mitigate potential threats. Evaluation of the proposed models demonstrates promising results, achieving high accuracy rates surpassing previous studies. The performance metrics, including accuracy, precision, recall, and F1 scores, along with Brier scores, are comprehensively analyzed to gauge the effectiveness of the models. Additionally, Explainable Machine Learning (XAI) techniques such as SHAP values provide transparent insights into the model's decision-making process. The study highlights the importance of securing HMIs within SCADA systems and offers valuable insights for future research directions in enhancing overall network security.",2770-7946,979-8-3503-7943-3,10.1109/ASYU62119.2024.10756979,,https://ieeexplore.ieee.org/stamp/stamp.jsp?arnumber=10756979,IDS;SCADA (Supervisory Control and Data Acquisition);Human Machine Interface;Machine Learning;Industrial Control Systems (ICS);Explainable Intrusion Detection Systems (x-ids),Measurement;Technological innovation;Accuracy;Protocols;Decision making;SCADA systems;Intrusion detection;Machine learning;Network security;Intelligent systems,,,,17,IEEE,28 Nov 2024,,,IEEE,IEEE Conferences
Towards Model-informed Precision Dosing with Expert-in-the-loop Machine Learning,Y. Kang; Y. -W. Chiu; M. -Y. Lin; F. -Y. Su; S. -T. Huang,"Department of Information Management, National Sun Yat-sen University, Kaohsiung, Taiwan; Department of Internal Medicine, Division of Nephrology, Kaohsiung Medical University Hospital, Kaohsiung, Taiwan; Department of Internal Medicine, Division of Nephrology, Kaohsiung Medical University Hospital, Kaohsiung, Taiwan; Department of Information Management, National Sun Yat-sen University, Kaohsiung, Taiwan; Department of Information Management, National Sun Yat-sen University, Kaohsiung, Taiwan",2021 IEEE 22nd International Conference on Information Reuse and Integration for Data Science (IRI),17 Nov 2021,2021,,,342,347,"Machine Learning (ML) and its applications have been transforming our lives but it is also creating issues related to the development of fair, accountable, transparent, and ethical Artificial Intelligence. As the ML models are not fully comprehensible yet, it is obvious that we still need humans to be part of algorithmic decision-making processes. In this paper, we consider a ML framework that may accelerate model learning and improve its interpretability by incorporating human experts into the model learning loop. We propose a novel human-in-the-loop ML framework aimed at dealing with learning problems that the cost of data annotation is high and the lack of appropriate data to model the association between the target tasks and the input features. With an application to precision dosing, our experimental results show that the approach can learn interpretable rules from data and may potentially lower experts' workload by replacing data annotation with rule representation editing. The approach may also help remove algorithmic bias by introducing experts' feedback into the iterative model learning process.",,978-1-6654-3875-9,10.1109/IRI51335.2021.00053,,https://ieeexplore.ieee.org/stamp/stamp.jsp?arnumber=9599105,Human-in-the-loop Machine Learning;Rule Learning;Representation Learning;Explainable Artificial Intelligence;Model-informed Precision Dosing,Ethics;Machine learning algorithms;Costs;Annotations;Decision making;Machine learning;Data models,,2,,36,IEEE,17 Nov 2021,,,IEEE,IEEE Conferences
Visualizing and Comparing Machine Learning Predictions to Improve Human-AI Teaming on the Example of Cell Lineage,J. Hong; R. Maciejewski; A. Trubuil; T. Isenberg,"Arizona State University, Tempe, AZ, USA; Arizona State University, Tempe, AZ, USA; Université Paris-Saclay, INRAE, Villeurbanne, France; Université Paris-Saclay, CNRS, Inria, Palaiseau, France",IEEE Transactions on Visualization and Computer Graphics,28 Feb 2024,2024,30,4,1956,1969,"We visualize the predictions of multiple machine learning models to help biologists as they interactively make decisions about cell lineage—the development of a (plant) embryo from a single ovum cell. Based on a confocal microscopy dataset, traditionally biologists manually constructed the cell lineage, starting from this observation and reasoning backward in time to establish their inheritance. To speed up this tedious process, we make use of machine learning (ML) models trained on a database of manually established cell lineages to assist the biologist in cell assignment. Most biologists, however, are not familiar with ML, nor is it clear to them which model best predicts the embryo's development. We thus have developed a visualization system that is designed to support biologists in exploring and comparing ML models, checking the model predictions, detecting possible ML model mistakes, and deciding on the most likely embryo development. To evaluate our proposed system, we deployed our interface with six biologists in an observational study. Our results show that the visual representations of machine learning are easily understandable, and our tool, LineageD+, could potentially increase biologists’ working efficiency and enhance the understanding of embryos.",1941-0506,,10.1109/TVCG.2023.3302308,Inria's Naviscope Project; ,https://ieeexplore.ieee.org/stamp/stamp.jsp?arnumber=10239303,Cell lineage;comparing ML predictions;human -AI teaming;machine learning;plant biology;visual analytics;visualization,Biological system modeling;Biology;Predictive models;Data models;Embryo;Three-dimensional displays;Data visualization,"Humans;Cell Lineage;Computer Graphics;Machine Learning;Databases, Genetic",1,,47,IEEE,4 Sep 2023,,,IEEE,IEEE Journals
Explainable Transformer Prototypes for Medical Diagnoses,U. Demir; D. Jha; Z. Zhang; E. Keles; B. Allen; A. K. Katsaggelos; U. Bagci,"Machine & Hybrid Intelligence Lab, Northwestern University, Chicago, IL, USA; Machine & Hybrid Intelligence Lab, Northwestern University, Chicago, IL, USA; Machine & Hybrid Intelligence Lab, Northwestern University, Chicago, IL, USA; Machine & Hybrid Intelligence Lab, Northwestern University, Chicago, IL, USA; Machine & Hybrid Intelligence Lab, Northwestern University, Chicago, IL, USA; Machine & Hybrid Intelligence Lab, Northwestern University, Chicago, IL, USA; Machine & Hybrid Intelligence Lab, Northwestern University, Chicago, IL, USA",2024 IEEE International Symposium on Biomedical Imaging (ISBI),22 Aug 2024,2024,,,1,5,"Deployments of artificial intelligence in medical diagnostics mandate not just accuracy and efficacy but also trust, emphasizing the need for explainability in machine decisions. The recent trend in automated medical image diagnostics leans towards the deployment of Transformer-based architectures, credited to their impressive capabilities. Since the self-attention feature of transformers contributes towards identifying crucial regions during the classification process, they enhance the trustability of the methods. However, the complex intricacies of these attention mechanisms may fall short of effectively pinpointing the regions of interest directly influencing AI decisions. Our research endeavors to innovate a unique attention block that underscores the correlation between ’regions’ rather than ’pixels’. To address this challenge, we introduce an innovative system grounded in prototype learning, featuring an advanced self-attention mechanism that goes beyond conventional ad-hoc visual explanation techniques by offering comprehensible visual insights. A combined quantitative and qualitative methodological approach was used to demonstrate the effectiveness of the proposed method on the large-scale NIH chest X-ray dataset. Experimental results showed that our proposed method offers a promising direction for explain-ability, which can lead to the development of more trustable systems, which can facilitate easier and rapid adoption of such technology into routine clinics. Code is available at www.github.com/NUBagcilab/r2r_proto.",1945-8452,979-8-3503-1333-8,10.1109/ISBI56570.2024.10635182,,https://ieeexplore.ieee.org/stamp/stamp.jsp?arnumber=10635182,Prototypes;Transformers;Explainability;Interpretability;Medical Diagnosis,Visualization;Prototypes;Transformers;Robustness;Classification algorithms;Medical diagnosis;Artificial intelligence,,1,,21,IEEE,22 Aug 2024,,,IEEE,IEEE Conferences
Covid-19 Computer-Aided Diagnosis through AI-Assisted CT Imaging Analysis: Deploying a Medical AI System,D. Gerogiannis; A. Arsenos; D. Kollias; D. Nikitopoulos; S. Kollias,"Dept. of Computer Science & Engineering, University of Ioannina / AIandMe SMPC, Ioannina, Greece; School of Electrical & Computer Engineering, National Technical University of Athens, Greece; School of Electronic Engineering & Computer Science, Queen Mary University of London, UK; GRNET, National Infrastructures for Research & Technology; School of Electrical & Computer Engineering, National Technical University of Athens, Greece",2024 IEEE International Symposium on Biomedical Imaging (ISBI),22 Aug 2024,2024,,,1,4,"Computer-aided diagnosis (CAD) systems stand out as potent aids for physicians in identifying the novel Coronavirus Disease 2019 (COVID-19) through medical imaging modalities. In this paper, we showcase the integration and reliable and fast deployment of a state-of-the-art AI system designed to automatically analyze CT images, offering infection probability for the swift detection of COVID-19. The suggested system, comprising both classification and segmentation components, is anticipated to reduce physicians’ detection time and enhance the overall efficiency of COVID-19 detection. We successfully surmounted various challenges, such as data discrepancy and anonymisation, testing the time-effectiveness of the model, and data security, enabling reliable and scalable deployment of the system on both cloud and edge environments. Additionally, our AI system assigns a probability of infection to each 3D CT scan and enhances explainability through anchor set similarity, facilitating timely confirmation and segregation of infected patients by physicians.",1945-8452,979-8-3503-1333-8,10.1109/ISBI56570.2024.10635484,Hellenic Foundation for Research and Innovation; ,https://ieeexplore.ieee.org/stamp/stamp.jsp?arnumber=10635484,Medical Imaging;COVID-19 Diagnosis;Deep Learning;Microservices;Cloud;Edge;Sandbox,COVID-19;Solid modeling;Three-dimensional displays;Computed tomography;Medical services;Reliability engineering;Computer aided diagnosis,,3,,7,IEEE,22 Aug 2024,,,IEEE,IEEE Conferences
Interpretable Classification of Pneumonia Infection Using eXplainable AI (XAI-ICP),R. -K. Sheu; M. S. Pardeshi; K. -C. Pai; L. -C. Chen; C. -L. Wu; W. -C. Chen,"Department of Computer Science, Tunghai University, Taichung, Taiwan; Artificial Intelligence (AI) Center, Tunghai University, Taichung, Taiwan; College of Engineering, Tunghai University, Taichung, Taiwan; Department of Computer Science, Tunghai University, Taichung, Taiwan; Department of Critical Care Medicine, Taichung Veterans General Hospital, Taichung, Taiwan; Department of Computer Science, Tunghai University, Taichung, Taiwan",IEEE Access,27 Mar 2023,2023,11,,28896,28919,"Open-box models in the medical domain have high acceptance and demand by many medical examiners. Even though the accuracy predicted by most of convolutional neural network (CNN) models is high, it is still not convincing as the detailed discussion regarding the outcome is semi-transparent in the functioning process. Pneumonia is known as one of the top contagious infections that makes most of the population affected due to low immunity. Therefore, the goal of this paper is to implement an interpretable classification of pneumonia infection using eXplainable AI (XAI-ICP). Thus, XAI-ICP is the highly efficient system designed to solve this challenge by adapting to the recent population health conditions. The aim is to design an interpretable deep classification and transfer learning based evaluation for pneumonia infection classification. The model is primarily pre-trained using the open Chest X-Ray (CXR) dataset from National Institutes of Health (NIH). Whereas, the training input and testing given to this system is Taichung Veterans General Hospital (TCVGH) for independent learning, Taiwan + VinDr open dataset for transfer learning of pneumonia affected patients with labeled CXR images possessing three features of infiltrate, cardiomegaly and effusion. The data labeling is performed by the medical examiners with the XAI human-in-the-loop approach. XAI-ICP demonstrates the XAI based reconfigurable DCNN with human-in-the-loop as a novel approach. The interpretable deep classification provides detailed transparency analysis and transfer learning for competitive accuracy. The purpose of this work, to design a re-configurable model that can continuously improve itself by using a feedback system and provide feasibility for the model deployment across multiple countries to provide an efficient system for the pneumonia infection classification. The designed model then provides detailed decisions taken at each step as transparency and features used within the algorithm for the pneumonia classification during the hospitalization. Thus, the scope can be given as explainable AI usage for the diagnosis classification using data preprocessing and interpretable deep convolutional neural network by the CXR evaluation. The accuracy achieved by using independent learning classification is 92.14% and is further improved based on successive transfer learning based evaluation is 93.29%. The XAI-ICP model adapts to the different populations by using transfer learning, while providing competitive results to the affected conditions.",2169-3536,,10.1109/ACCESS.2023.3255403,"Ministry of Science and Technology, Taiwan(grant numbers:MOST 111-2321-B-075A-001);",https://ieeexplore.ieee.org/stamp/stamp.jsp?arnumber=10065420,Medical XAI;XAI pnuemonia;transfer learning;pneumonia infection,Pulmonary diseases;Transfer learning;Artificial intelligence;Solid modeling;Medical diagnostic imaging;Convolutional neural networks;Data models,,21,,58,CCBYNCND,10 Mar 2023,,,IEEE,IEEE Journals
